{
  "registry_version": "1.0.0",
  "registry_id": "action-registry-industrial-line2",
  "effective_from": "2026-04-01T00:00:00Z",
  "effective_until": "2026-10-01T00:00:00Z",
  "conflict_resolution": "registry_wins",
  "degraded_mode_default": "queue",
  "actions": {
    "recommend_inspection": {
      "action_type": "recommend_inspection",
      "description": "Recommend a human technician inspect the asset. Non-destructive. No physical action taken.",
      "autonomous_allowed": true,
      "human_review_required_above_severity": "medium",
      "requires_safety_layer": false,
      "requires_zone_clearance": false,
      "default_expiry_seconds": 300,
      "max_expiry_seconds": 900,
      "allowed_runtime_modes": ["SOFT_REALTIME", "ASYNC_REVIEW", "OBSERVATION_MODE"],
      "degraded_mode_behavior": "queue",
      "registry_wins_over_payload": true,
      "audit_required": true,
      "notes": "High severity forces human review even though autonomous_allowed is true. Registry wins."
    },
    "notify_engineer": {
      "action_type": "notify_engineer",
      "description": "Send notification to on-call engineer. No physical action.",
      "autonomous_allowed": true,
      "requires_safety_layer": false,
      "requires_zone_clearance": false,
      "default_expiry_seconds": 120,
      "max_expiry_seconds": 300,
      "allowed_runtime_modes": ["SOFT_REALTIME", "ASYNC_REVIEW", "DEGRADED_MODE", "OBSERVATION_MODE"],
      "degraded_mode_behavior": "queue",
      "registry_wins_over_payload": true,
      "audit_required": true
    },
    "schedule_maintenance": {
      "action_type": "schedule_maintenance",
      "description": "Insert a maintenance task into the operations queue. Deferred action, no immediate physical effect.",
      "autonomous_allowed": true,
      "human_review_required_above_severity": "high",
      "requires_safety_layer": false,
      "requires_zone_clearance": false,
      "default_expiry_seconds": 600,
      "max_expiry_seconds": 3600,
      "allowed_runtime_modes": ["ASYNC_REVIEW", "OBSERVATION_MODE"],
      "degraded_mode_behavior": "queue",
      "registry_wins_over_payload": true,
      "audit_required": true
    },
    "reduce_motor_load": {
      "action_type": "reduce_motor_load",
      "description": "Instruct motor controller to reduce operating load by a configured percentage. Physical effect, reversible.",
      "autonomous_allowed": false,
      "requires_safety_layer": true,
      "requires_zone_clearance": false,
      "default_expiry_seconds": 60,
      "max_expiry_seconds": 120,
      "allowed_runtime_modes": ["SOFT_REALTIME", "ASYNC_REVIEW"],
      "degraded_mode_behavior": "block",
      "registry_wins_over_payload": true,
      "audit_required": true,
      "notes": "Autonomous not allowed. Human review mandatory. Short expiry: load decisions are time-sensitive."
    },
    "vent_pressure": {
      "action_type": "vent_pressure",
      "description": "Open pressure relief valve. Irreversible during operation. Physical hazard if personnel nearby.",
      "autonomous_allowed": false,
      "requires_safety_layer": true,
      "requires_zone_clearance": true,
      "default_expiry_seconds": 30,
      "max_expiry_seconds": 60,
      "allowed_runtime_modes": ["SOFT_REALTIME"],
      "degraded_mode_behavior": "block",
      "registry_wins_over_payload": true,
      "audit_required": true,
      "notes": "personnel_nearby must be false. Safety layer must be available. Any failure blocks. No queuing."
    },
    "emergency_shutdown": {
      "action_type": "emergency_shutdown",
      "description": "Full motor shutdown. Routes to safety layer. Nano governs the recommendation path only; actual shutdown is safety layer responsibility.",
      "autonomous_allowed": false,
      "requires_safety_layer": true,
      "requires_zone_clearance": false,
      "default_expiry_seconds": 15,
      "max_expiry_seconds": 15,
      "allowed_runtime_modes": ["SOFT_REALTIME"],
      "degraded_mode_behavior": "block",
      "registry_wins_over_payload": true,
      "audit_required": true,
      "notes": "Nano does not execute shutdown. Nano validates and routes to safety layer. Safety layer acts independently. Nano must never delay this routing."
    }
  }
}
